{
  "schema_version": "1.0.0",
  "session_id": "MYE_PAIR_SESSION_000001",
  "session_version": 4,
  "status": "IN_PROGRESS",
  "created_at": "2026-08-15T17:57:06.284Z",
  "updated_at": "2026-08-15T18:22:39.884Z",
  "memory_snapshot": {
    "memory_id": "approved-direction-memory",
    "memory_version": 18,
    "image_count": 21,
    "pairwise_evidence_count": 0,
    "inferred_preference_count": 0,
    "scores_count": 0,
    "weights_count": 0
  },
  "selection_policy": {
    "selected_by": "SYSTEM",
    "pair_selection_is_preference": false,
    "labels_may_not_decide_winner": true,
    "decision_authority": "HUMAN",
    "target_pair_count": 5,
    "presentation_ordering_rule": "A/B positions are alternated where practical; no side encodes the historical label."
  },
  "pairs": [
    {
      "pair_id": "MYE_PAIRSEL_000001",
      "pair_type": "STANDARD_PAIR",
      "image_a": {
        "image_id": "MYE_IMG_000001",
        "original_filename": "1.jpeg",
        "source_path": "data/my_eyes/approved/1.jpeg",
        "sha256": "40975d27a24c6bbf75da03d4fb97dfafd0844f6305503f89a476ee0bb946a5eb",
        "mime_type": "image/jpeg",
        "label_snapshot": {
          "decision": "APPROVED",
          "evidence_id": "MYE_DEC_000001",
          "attached_as_context_only": true,
          "does_not_imply_pairwise_winner": true
        }
      },
      "image_b": {
        "image_id": "MYE_IMG_000020",
        "original_filename": "4.png",
        "source_path": "data/my_eyes/rejected/4.png",
        "sha256": "78d6339aebbd1fca19d8e2dc9ee36ac8110c7a3ed1e7ad08686d9750d41c3144",
        "mime_type": "image/png",
        "label_snapshot": {
          "decision": "REJECTED",
          "evidence_id": "MYE_DEC_000020",
          "attached_as_context_only": true,
          "does_not_imply_pairwise_winner": true
        }
      },
      "selection": {
        "selected_by": "SYSTEM",
        "selection_reason": "Both are portrait promotional compositions centered on an arms-crossed man, oversized typography and technology/design staging. The comparison isolates hierarchy, typography density and subject/type interaction without assuming which treatment is preferable.",
        "hypothesis_refs": [
          "MYE_HYP_000002"
        ],
        "candidate_signal_refs": [
          "MYE_EXT_SIG_000002",
          "MYE_EXT_SIG_000003"
        ],
        "comparable_dimensions": [
          "FORMAT",
          "SUBJECT_PROMINENCE",
          "TYPOGRAPHY_DENSITY",
          "VISUAL_HIERARCHY",
          "DEPTH_STRATEGY"
        ],
        "refutation_capable": true,
        "label_based_winner_inference": false,
        "bias_warning": "Historical APPROVED/REJECTED labels are context only. Either image may win, and TIE is valid."
      },
      "evidence_snapshot": {
        "memory_version": 18,
        "image_a_analysis_refs": [
          {
            "analysis_id": "MYE_ANA_000006",
            "analysis_version": 1,
            "record_path": "data/my_eyes/analysis/MYE_IMG_000001.visual.v1.json"
          }
        ],
        "image_b_analysis_refs": [
          {
            "analysis_id": "MYE_ANA_000014",
            "analysis_version": 1,
            "record_path": "data/my_eyes/analysis/MYE_IMG_000020.visual.v1.json"
          }
        ],
        "human_label_evidence_refs": [
          "MYE_DEC_000001",
          "MYE_DEC_000020"
        ],
        "external_batch_refs": []
      },
      "decision_authority": "HUMAN",
      "human_decision": {
        "status": "COMPLETED",
        "decision_version": 1,
        "winner": "IMAGE_A",
        "raw_reason": "**Escolha:** A\n**O que fez ganhar:** contraste melhor, rim light bem aplicado, cores mais coerentes, realismo e integração superiores; um único elemento flutuante com mais valor visual que vários elementos da B.\n**O que fez B perder:** excesso de elementos flutuantes e microdetalhes, cores/contraste com aparência mais artificial e menor integração entre personagem, fundo e objetos.\n**Manteria algo da B:** a ideia de tipografia grande atrás do personagem pode funcionar, se usada com muito mais controle.\n**Dificuldade:** EASY",
        "winner_reason": "contraste melhor, rim light bem aplicado, cores mais coerentes, realismo e integração superiores; um único elemento flutuante com mais valor visual que vários elementos da B.",
        "loser_reason": "excesso de elementos flutuantes e microdetalhes, cores/contraste com aparência mais artificial e menor integração entre personagem, fundo e objetos.",
        "keep_from_loser": "a ideia de tipografia grande atrás do personagem pode funcionar, se usada com muito mais controle.",
        "decision_difficulty": "EASY",
        "decisive_visual_dimension": null,
        "explicit_human_response": true,
        "provenance": {
          "asserted_by": "HUMAN",
          "recorded_by": "PAIRWISE_SESSION_SERVICE",
          "source_type": "HUMAN_PAIRWISE_DECISION",
          "source_ref": "codex-user-message://2026-08-15#pair-01#MYE_PAIR_000001",
          "recorded_at": "2026-08-15T18:22:39.787Z",
          "data_classification": "REAL_HUMAN_EVIDENCE",
          "pair_id": "MYE_PAIRSEL_000001"
        }
      },
      "decision_history": [
        {
          "status": "COMPLETED",
          "decision_version": 1,
          "winner": "IMAGE_A",
          "raw_reason": "**Escolha:** A\n**O que fez ganhar:** contraste melhor, rim light bem aplicado, cores mais coerentes, realismo e integração superiores; um único elemento flutuante com mais valor visual que vários elementos da B.\n**O que fez B perder:** excesso de elementos flutuantes e microdetalhes, cores/contraste com aparência mais artificial e menor integração entre personagem, fundo e objetos.\n**Manteria algo da B:** a ideia de tipografia grande atrás do personagem pode funcionar, se usada com muito mais controle.\n**Dificuldade:** EASY",
          "winner_reason": "contraste melhor, rim light bem aplicado, cores mais coerentes, realismo e integração superiores; um único elemento flutuante com mais valor visual que vários elementos da B.",
          "loser_reason": "excesso de elementos flutuantes e microdetalhes, cores/contraste com aparência mais artificial e menor integração entre personagem, fundo e objetos.",
          "keep_from_loser": "a ideia de tipografia grande atrás do personagem pode funcionar, se usada com muito mais controle.",
          "decision_difficulty": "EASY",
          "decisive_visual_dimension": null,
          "explicit_human_response": true,
          "provenance": {
            "asserted_by": "HUMAN",
            "recorded_by": "PAIRWISE_SESSION_SERVICE",
            "source_type": "HUMAN_PAIRWISE_DECISION",
            "source_ref": "codex-user-message://2026-08-15#pair-01#MYE_PAIR_000001",
            "recorded_at": "2026-08-15T18:22:39.787Z",
            "data_classification": "REAL_HUMAN_EVIDENCE",
            "pair_id": "MYE_PAIRSEL_000001"
          }
        }
      ],
      "structured_pair_reason": null,
      "structured_reason_history": []
    },
    {
      "pair_id": "MYE_PAIRSEL_000002",
      "pair_type": "DIAGNOSTIC_PAIR",
      "image_a": {
        "image_id": "MYE_IMG_000019",
        "original_filename": "3.png",
        "source_path": "data/my_eyes/rejected/3.png",
        "sha256": "fd78a948ac123108bad39cf90136eb6c016434dafc09af834560da38cddadb57",
        "mime_type": "image/png",
        "label_snapshot": {
          "decision": "REJECTED",
          "evidence_id": "MYE_DEC_000019",
          "attached_as_context_only": true,
          "does_not_imply_pairwise_winner": true
        }
      },
      "image_b": {
        "image_id": "MYE_IMG_000013",
        "original_filename": "13.jpeg",
        "source_path": "data/my_eyes/approved/13.jpeg",
        "sha256": "77b2f72757d6f313544a6a8425ae9a58b219ca390069b36bf4ca2e717092df0f",
        "mime_type": "image/jpeg",
        "label_snapshot": {
          "decision": "APPROVED",
          "evidence_id": "MYE_DEC_000013",
          "attached_as_context_only": true,
          "does_not_imply_pairwise_winner": true
        }
      },
      "selection": {
        "selected_by": "SYSTEM",
        "selection_reason": "Both use a central male subject, surreal scale, numerous floating objects and high visual ambition. This pair tests whether complexity is experienced as functional and convergent or as artificial and uncontrolled; either side may be chosen or tied.",
        "hypothesis_refs": [
          "MYE_HYP_000002"
        ],
        "candidate_signal_refs": [
          "MYE_EXT_SIG_000001",
          "MYE_EXT_SIG_000002",
          "MYE_EXT_SIG_000004"
        ],
        "comparable_dimensions": [
          "CONTROLLED_VS_ARTIFICIAL_COMPLEXITY",
          "VISUAL_CONVERGENCE",
          "OBJECT_FUNCTION",
          "MICRODETAIL_DENSITY",
          "SURREAL_LANGUAGE"
        ],
        "refutation_capable": true,
        "label_based_winner_inference": false,
        "bias_warning": "Historical APPROVED/REJECTED labels are context only. Either image may win, and TIE is valid."
      },
      "evidence_snapshot": {
        "memory_version": 18,
        "image_a_analysis_refs": [
          {
            "analysis_id": "MYE_ANA_000009",
            "analysis_version": 1,
            "record_path": "data/my_eyes/analysis/MYE_IMG_000019.visual.v1.json"
          }
        ],
        "image_b_analysis_refs": [
          {
            "analysis_id": "MYE_ANA_000015",
            "analysis_version": 1,
            "record_path": "data/my_eyes/analysis/MYE_IMG_000013.visual.v1.json"
          }
        ],
        "human_label_evidence_refs": [
          "MYE_DEC_000019",
          "MYE_DEC_000013"
        ],
        "external_batch_refs": [
          "MYE_EXT_BATCH_000001"
        ]
      },
      "decision_authority": "HUMAN",
      "human_decision": {
        "status": "COMPLETED",
        "decision_version": 1,
        "winner": "IMAGE_B",